,Name,Age,Hometown,Position,Survived,latitude,longitude,altitude
0,"Brailey, Theodore Ronald",24,"London, Greater London, England, United Kingdom",Pianist,False,51.5073219,-0.1276474,0.0
1,"Bricoux, Roger Marie",20,"Cosne sur Loire, Rue Eugène Perreau, Cosne-Cours-sur-Loire, Nièvre, Bourgogne-Franche-Comté, France métropolitaine, 58200, France",Cellist,False,47.4151279,2.9315659,0.0
2,"Clarke, John Frederick Preston",30,"Leeds and Liverpool Canal (Rufford Branch), Rufford, West Lancashire, Lancashire, North West England, England, L40 1TA, United Kingdom",Bassist,False,53.6326141,-2.8105631,0.0
3,"Hartley, Wallace",33,"Colne, Leach Street, Knotts, Colne, Pendle, Lancashire, North West England, England, BB8 9NS, United Kingdom","Bandmaster, violinist",False,53.8549144,-2.181886,0.0
4,"Hume, John Law",21,"Dumfries, Dumfries and Galloway, Scotland, DG1 1HS, United Kingdom",Violinist,False,55.069836,-3.6092292,0.0
5,"Krins, Georges Alexandre",23,"London, Greater London, England, United Kingdom",Violinist,False,51.5073219,-0.1276474,0.0
6,"Taylor, Percy Cornelius",32,"London, Greater London, England, United Kingdom",Cellist,False,51.5073219,-0.1276474,0.0
7,"Woodward, John Wesley",32,"Oxford, Oxfordshire, South East England, England, United Kingdom",Cellist,False,51.7520131,-1.2578499,0.0
